{
  "schema_version": 1,
  "workspace": "default",
  "batch_id": "acoord-blocked-2026-07-22",
  "blocker": {
    "message": "Batch blocked: operator must authorize force-push to a shared branch.",
    "decisions": [
      "Approve force-push to shared branch?",
      "Proceed with partial batch or wait?"
    ]
  }
}
